image,caption_number,caption,id
3556037801_3992ce6826.jpg,2,A woman in a bicycle store where two men are working on a bike .,234
3556037801_3992ce6826.jpg,3,A woman in a red shirt is examining one of many bicycles while a man in a blue shirt is adjusting a wheel .,234
3556037801_3992ce6826.jpg,4,People shopping in a bike shop .,234
3556037801_3992ce6826.jpg,1,A man works in a bike shop .,234
2251747182_6b67a3ab8b.jpg,4,The little boy in the red shorts is going to shoot a basket .,235
2251747182_6b67a3ab8b.jpg,1,A young boy holding a basketball about to shoot .,235
2251747182_6b67a3ab8b.jpg,0,A boy playing basketball in a gym,235
2251747182_6b67a3ab8b.jpg,3,The boy in the white jersey is dribbling the orange Wizards basketball .,235
2251747182_6b67a3ab8b.jpg,2,"A young boy , playing basketball , is getting ready to take a shot .",235
3189293145_35dea42679.jpg,1,Two birds are fighting each other in tall grass .,236
3189293145_35dea42679.jpg,2,Two birds are standing in a wooded area .,236
3189293145_35dea42679.jpg,0,One bird opens its mouth while the other bird looks back at it .,236
3189293145_35dea42679.jpg,3,Two birds interacting in the grass,236
3189293145_35dea42679.jpg,4,Two colorful birds facing each other .,236
639120223_7db6bdb61f.jpg,3,Two workers at a grocery store observing something out of camera range .,237
639120223_7db6bdb61f.jpg,0,Two grocery store employees talk at a checkstand .,237
639120223_7db6bdb61f.jpg,2,Two workers at a grocery store .,237
639120223_7db6bdb61f.jpg,1,Two people are working at a coffee shop,237
639120223_7db6bdb61f.jpg,4,Two workers in a store are wearing aprons .,237
3582920844_2742804f3d.jpg,4,A woman flips her hair full of water and sprays the water all around .,238
3582920844_2742804f3d.jpg,1,A long haired man in the water is swinging his head causing the water to spray in a spiral .,238
3582920844_2742804f3d.jpg,3,A person in the water .,238
3582920844_2742804f3d.jpg,2,A man wading in a lake dips his long hair into the water and quickly throws his head back making a brief rainbow of water overhear .,238
3582920844_2742804f3d.jpg,0,A long haired mail is swinging his wet hair around in the ocean .,238
508261758_78fb8ae067.jpg,2,Three girls playing on the ground .,239
508261758_78fb8ae067.jpg,0,Three girls fell on top of one another and are laughing histerically .,239
508261758_78fb8ae067.jpg,4,Three young girls play wrestling and laugh a lot .,239
508261758_78fb8ae067.jpg,3,"Three teenage girls rolling all over each other on the ground , laughing",239
508261758_78fb8ae067.jpg,1,Three girls pile on top of each other on the concrete .,239
3174431688_ae84778db0.jpg,0,a couple standing outside in the dark near some festive lights .,240
3174431688_ae84778db0.jpg,3,Two people stand looking at a light sculpture at night .,240
3174431688_ae84778db0.jpg,4,Two people wearing black are standing in front of a lit up statue .,240
3174431688_ae84778db0.jpg,2,"Two men meet by a fountain engulfed in lights , they are wearing Winter coats .",240
3174431688_ae84778db0.jpg,1,Beautiful lights accent trees on a dark night .,240
498957941_f0eda42787.jpg,4,Little boy running very fast .,241
498957941_f0eda42787.jpg,3,A young boy runs .,241
498957941_f0eda42787.jpg,0,A boy in a blue shirt is running .,241
498957941_f0eda42787.jpg,1,A distorted image of a young boy running,241
498957941_f0eda42787.jpg,2,"A little boy running , blurry picture .",241
1007129816_e794419615.jpg,1,A man wears an orange hat and glasses .,242
1007129816_e794419615.jpg,3,A man with glasses is wearing a beer can crocheted hat .,242
1007129816_e794419615.jpg,2,A man with gauges and glasses is wearing a Blitz hat .,242
1007129816_e794419615.jpg,4,The man with pierced ears is wearing glasses and an orange hat .,242
1007129816_e794419615.jpg,0,A man in an orange hat starring at something .,242
3286620180_4b00e93e8e.jpg,2,A large group of men and woman all wearing red t-shirts participate in a race .,243
3286620180_4b00e93e8e.jpg,4,There are hundreds of people with red shirts running a marathon .,243
3286620180_4b00e93e8e.jpg,1,A group of people in red are running down the road .,243
3286620180_4b00e93e8e.jpg,0,A crowd of people wearing red shirts runs along a city road .,243
3286620180_4b00e93e8e.jpg,3,The people in orange t-shirts are jogging on the street .,243
2689163361_4939875be5.jpg,2,The girl in the pink shirt is twirling a ribbon .,244
2689163361_4939875be5.jpg,4,Young girl playing with streamers .,244
2689163361_4939875be5.jpg,0,a girl wearing a bright pink top is spinning a colorful ribbon around her body .,244
2689163361_4939875be5.jpg,3,"The girl is twirling long , colorful streamers .",244
2689163361_4939875be5.jpg,1,A little girl in a pink shirt and a jean skirt is playing with a ribbon wand outside .,244
3094568845_d0b56c5651.jpg,0,A race car is spinning out in front of spectators .,245
3094568845_d0b56c5651.jpg,3,Green and black car goes into wall at race .,245
3094568845_d0b56c5651.jpg,2,A super car is spinning tires on a raceway track creating smoke near a crowd .,245
3094568845_d0b56c5651.jpg,1,a racer skids out .,245
3094568845_d0b56c5651.jpg,4,Smoke comes from car in professional race,245
1177994172_10d143cb8d.jpg,4,Two young boys are squirting water at each other .,246
1177994172_10d143cb8d.jpg,1,Two boys are squirting water guns at each other .,246
1177994172_10d143cb8d.jpg,0,"Two blonde boys , one in a camouflage shirt and the other in blue , are having a water fight .",246
1177994172_10d143cb8d.jpg,3,Two children wearing jeans squirt water at each other .,246
1177994172_10d143cb8d.jpg,2,Two boys spraying each other with water,246
2073105823_6dacade004.jpg,4,A snowboarder rides down a handrail without snow .,247
2073105823_6dacade004.jpg,2,a person is sliding down a brick rail on a snowboard .,247
2073105823_6dacade004.jpg,1,A man skateboards down a steep railing next to some steps .,247
2073105823_6dacade004.jpg,0,A man in a black hoodie and jeans skateboards down a railing .,247
2073105823_6dacade004.jpg,3,A person walks down the brick railing near a set of steps .,247
521186251_e97d1f50f8.jpg,3,The kids ride a boat in the water .,248
521186251_e97d1f50f8.jpg,4,Three girls and one boy are holding onto a raft as they are being pulled by a road through the water .,248
521186251_e97d1f50f8.jpg,1,Several girls on a raft floating in rough waters .,248
521186251_e97d1f50f8.jpg,2,The four kids are riding a raft on the water .,248
521186251_e97d1f50f8.jpg,0,four children lay on a tube .,248
2800990525_a1f8427272.jpg,3,A man with sunglasses on his head is standing by signs for the Wharf and ferry terminal .,249
2800990525_a1f8427272.jpg,1,A man poses outside of some buildings .,249
2800990525_a1f8427272.jpg,2,A man stands next to signs for the wharfs .,249
2800990525_a1f8427272.jpg,4,A man with sunglasses on his head poses for a picture near the wharf .,249
2800990525_a1f8427272.jpg,0,A man is walking in the street with sunglasses on top of his head .,249
412082368_371df946b3.jpg,1,A child gets ready to swing at a pinata .,250
412082368_371df946b3.jpg,0,"A boy holds a blue stick , as a man holds a pinata above him .",250
412082368_371df946b3.jpg,3,Boy in red shirt getting ready to hit the pinata .,250
412082368_371df946b3.jpg,2,A young boy is getting ready to hit a pinata with a blue baseball bat .,250
412082368_371df946b3.jpg,4,the young boy takes a swing at the pinata .,250
97406261_5eea044056.jpg,4,The yellow and black cat and the brown and black dog are fighting .,251
97406261_5eea044056.jpg,3,A multicolor cat fighting with a black and brown dog in a red collar .,251
97406261_5eea044056.jpg,2,A dog and cat are fighting on a chair .,251
97406261_5eea044056.jpg,1,A cat swatting at a doberman dog,251
97406261_5eea044056.jpg,0,A calico cat raising its paws towards a dog with an open mouth,251
3674168459_6245f4f658.jpg,3,Two female martial artists demonstrate a kick for an audience .,252
3674168459_6245f4f658.jpg,2,One martial artist kicks another 's face during a competition .,252
3674168459_6245f4f658.jpg,4,Two women participate in a martial arts match .,252
3674168459_6245f4f658.jpg,1,One karate sportwoman kicks a karate sportman,252
3674168459_6245f4f658.jpg,0,A female martial artist kicking another female martial artist in the face,252
3631344685_ed0f3e091b.jpg,3,An ump in black watches a baseball game .,253
3631344685_ed0f3e091b.jpg,4,The baseball player takes a swing .,253
3631344685_ed0f3e091b.jpg,2,A batsman is about to swing for a baseball whilst the catcher and referee wait behind him .,253
3631344685_ed0f3e091b.jpg,0,a baseball player just taking a swing at a stadium .,253
3631344685_ed0f3e091b.jpg,1,A baseball player swings the bat as a catcher and umpire watch .,253
2643263887_a32ffb878f.jpg,1,A boy in green trunks slides down a water slide .,254
2643263887_a32ffb878f.jpg,2,A boy slides down an inflatable water slide .,254
2643263887_a32ffb878f.jpg,0,A boy going down a water slide .,254
2643263887_a32ffb878f.jpg,4,A young boy smiling as he rides down an inflatable water slide .,254
2643263887_a32ffb878f.jpg,3,A child reaches the bottom of an inflatable slide .,254
2460159430_71ab1aacfa.jpg,4,Two dogs running through tall grass .,255
2460159430_71ab1aacfa.jpg,3,A tan dog is bounding through grass .,255
2460159430_71ab1aacfa.jpg,2,"A dog running in long grass , a housing development behind it .",255
2460159430_71ab1aacfa.jpg,0,A brown dog races through a field .,255
2460159430_71ab1aacfa.jpg,1,a brown dog running through the tall grass .,255
1446933195_8fe9725d62.jpg,0,A black puppy is biting a tree limb .,256
1446933195_8fe9725d62.jpg,2,A puppy dog is playing with a branch .,256
1446933195_8fe9725d62.jpg,4,A young brown puppy pulls a leafy branch in his teeth in a backyard .,256
1446933195_8fe9725d62.jpg,3,A puppy is gnawing on a plant branch in an uncut grassy area with wood and a barrel nearby .,256
1446933195_8fe9725d62.jpg,1,A brown puppy chewing on a tree branch .,256
2462153092_e3f4d8f6a2.jpg,3,A girl runs with dogs in a dry field .,257
2462153092_e3f4d8f6a2.jpg,1,A girl is running through a field with a brown dog and white dog running beside her .,257
2462153092_e3f4d8f6a2.jpg,0,A girl in purple pants running with two dogs .,257
2462153092_e3f4d8f6a2.jpg,4,Girl running through a field with a brown dog and a white dog .,257
2462153092_e3f4d8f6a2.jpg,2,A girl running outside with three dogs,257
410453140_5401bf659a.jpg,2,A man stands at the entrance of Yerba Buena Center for the Arts .,258
410453140_5401bf659a.jpg,0,A man is standing in front of glass doors with a blue spot and a pink spot .,258
410453140_5401bf659a.jpg,1,A man is standing outside the glass doors of an art center .,258
410453140_5401bf659a.jpg,4,Person standing at glass doors with big blue circle and big pink circle,258
410453140_5401bf659a.jpg,3,A man walking through glass double doors .,258
3238951136_2a99f1a1a8.jpg,3,Man in red shoes and red and white print shorts posing in front of rocks by water .,259
3238951136_2a99f1a1a8.jpg,1,A man wearing flowered swimming trunks is standing near large mossy rocks .,259
3238951136_2a99f1a1a8.jpg,0,A man in swimming trunks is standing against some rocks .,259
3238951136_2a99f1a1a8.jpg,4,Man posing by a natural pool .,259
3238951136_2a99f1a1a8.jpg,2,A man wearing red shorts is holding onto the rocks beside the water .,259
566794440_f9ec673a2f.jpg,1,A woman in camouflage and her hair up in a ponytail walks on the field with a black softball glove on one hand .,260
566794440_f9ec673a2f.jpg,0,girls with baseball gloves walking across a baseball field,260
566794440_f9ec673a2f.jpg,2,A woman playing baseball walks back to her base while her feamle teammate follows .,260
566794440_f9ec673a2f.jpg,3,A woman with a glove on a baseball field with another woman,260
566794440_f9ec673a2f.jpg,4,The girls return to the field during their softball game .,260
1776981714_5b224d0f7a.jpg,0,two Asian women walking in front of a green door,261
1776981714_5b224d0f7a.jpg,1,Two girls are walking along the street and talking .,261
1776981714_5b224d0f7a.jpg,3,two women walk down the street .,261
1776981714_5b224d0f7a.jpg,2,Two women walk down a street .,261
1776981714_5b224d0f7a.jpg,4,Two women walking down the street,261
3507670136_2e5f94accf.jpg,0,A dirt biker is taking a large jump wearing a yellow suit .,262
3507670136_2e5f94accf.jpg,1,A man in yellow performs a bike trick .,262
3507670136_2e5f94accf.jpg,4,The motorcycle racer in a yellow uniform is in midair .,262
3507670136_2e5f94accf.jpg,2,A motocross bike is jumping through the air over a dirt track .,262
3507670136_2e5f94accf.jpg,3,A person wearing yellow is taking a jump on a dirt bike .,262
3090600019_8808fe7a9d.jpg,2,An attractive police lady and a jailbird pose for a photo .,263
3090600019_8808fe7a9d.jpg,4,"There is a woman in a sexy cop 's uniform and a guy dressed as a prisoner , standing outdoors .",263
3090600019_8808fe7a9d.jpg,1,A man dresses as a prisoner and a woman dressed as a cop on a sidewalk .,263
3090600019_8808fe7a9d.jpg,0,A man and a woman dressed as a prisoner and sexy police officer .,263
3090600019_8808fe7a9d.jpg,3,Man stands next to woman dressed up as a fake police officer .,263
3643684044_a131168127.jpg,1,Four judges are sitting at a table with the center left one speaking .,264
3643684044_a131168127.jpg,0,A team of four judges rates a competition .,264
3643684044_a131168127.jpg,3,Man in red shirt speaks into microphone,264
3643684044_a131168127.jpg,4,The gentleman is speaking while the others are listening .,264
3643684044_a131168127.jpg,2,"Four people are sitting at a table , with microphones and bottles of water in front of them .",264
1517340899_ee1c74a8f6.jpg,4,The girl in a pink shirt jumps high over the grass .,265
1517340899_ee1c74a8f6.jpg,2,A young blonde girl with a pink shirt on jumps high into the air while kicking her foot out and sticking her tongue out .,265
1517340899_ee1c74a8f6.jpg,1,A girl jumps in the grass .,265
1517340899_ee1c74a8f6.jpg,3,The blond girl is jumping up in the air .,265
1517340899_ee1c74a8f6.jpg,0,A girl jumping in the grass .,265
905355838_3a43fdfd4e.jpg,0,A baseball player standing on the field,266
905355838_3a43fdfd4e.jpg,3,A male ballplayer wearing a white and blue uniform playing in front of a large crowd .,266
905355838_3a43fdfd4e.jpg,4,Baseball player looking out into a stadium crowd,266
905355838_3a43fdfd4e.jpg,1,a baseball player stands and faces the crowd .,266
905355838_3a43fdfd4e.jpg,2,A baseball player wearing a number 19 shirt looks at the outfield .,266
3551170666_01df31412d.jpg,1,A white dog nurses her pups .,267
3551170666_01df31412d.jpg,2,Golden female dog feeding newborn litter of puppies .,267
3551170666_01df31412d.jpg,3,The dog and her puppies lay on a blanket .,267
3551170666_01df31412d.jpg,0,A golden retriever nurses puppies .,267
3551170666_01df31412d.jpg,4,The momma dog is feeding her litter of pups .,267
3178005751_fca19815ac.jpg,4,two people posing for the picture with a few trees in the background,268
3178005751_fca19815ac.jpg,3,Smiling woman with man in striped sweatshir in the park .,268
3178005751_fca19815ac.jpg,0,"A boy and girl , both in jeans , are standing in front of a fence .",268
3178005751_fca19815ac.jpg,1,A girl in gray and a guy in stripes pose against a fence .,268
3178005751_fca19815ac.jpg,2,"A man and woman stand next two each other , in front of a wood fence .",268
3561314880_ea9a7e245f.jpg,3,A scruffy man is standing in front of a red shopping cart filled with boxes .,269
3561314880_ea9a7e245f.jpg,0,a dirty looking man standing in front of an overfilled red grocery chart,269
3561314880_ea9a7e245f.jpg,1,A homeless man has a shopping cart full of junk .,269
3561314880_ea9a7e245f.jpg,2,A older man is wearing a torn up suit and is leaning on an orange shopping cart full of items .,269
3561314880_ea9a7e245f.jpg,4,A shabby looking man stands near a carriage full of crates .,269
2110898123_07729c1461.jpg,3,A dog wearing a red cape runs quickly across a field .,270
2110898123_07729c1461.jpg,0,A brown dog wearing a red vest is running in the grass .,270
2110898123_07729c1461.jpg,4,The brown dog is running on the grass whilst wearing an orange jacket .,270
2110898123_07729c1461.jpg,2,a dog sprints across the grass .,270
2110898123_07729c1461.jpg,1,A brown dog wearing a red vest is running through the grass .,270
2120571547_05cd56de85.jpg,1,A woman is stretching he legs across three seats on a subway train .,271
2120571547_05cd56de85.jpg,3,Two women in winter clothes ride in a subway car with orange and yellow seats .,271
2120571547_05cd56de85.jpg,2,A woman sites with her feet on the seats in a subway car .,271
2120571547_05cd56de85.jpg,4,Two women sit on a city train .,271
2120571547_05cd56de85.jpg,0,A woman in black sitting on a train .,271
339350939_6643bfb270.jpg,0,A black dog chases birds on the shoreline,272
339350939_6643bfb270.jpg,4,There is a dog running along the beach .,272
339350939_6643bfb270.jpg,1,A black dog is chasing two birds on the shore of the ocean .,272
339350939_6643bfb270.jpg,2,A dog is running along the beach beside the ocean .,272
339350939_6643bfb270.jpg,3,Black dog running behind three birds on shore with waves in the background .,272
3068994801_b2bc079e67.jpg,4,A woman with a purple top and blue pants walks her bike in the shadows .,273
3068994801_b2bc079e67.jpg,3,A woman walks a bicycle between some columns .,273
3068994801_b2bc079e67.jpg,2,A woman in a purple top is walking a bicycle between two stone columns .,273
3068994801_b2bc079e67.jpg,1,A girl in vibrant colors is walking her bike in a dark area .,273
3068994801_b2bc079e67.jpg,0,A girl dressed in purple and blue walks beside her bike at night .,273
566794036_60f7acdf35.jpg,2,An athlete in red shorts is caught frozen during a basketball move .,274
566794036_60f7acdf35.jpg,4,Man in red shorts bouncing a basketball .,274
566794036_60f7acdf35.jpg,3,A shirtless man in red shorts bouncing a basketball on a court .,274
566794036_60f7acdf35.jpg,0,A man wearing red shorts dribbles a basketball behind him .,274
566794036_60f7acdf35.jpg,1,A man with no shirt plays basketball .,274
3209620285_edfc479392.jpg,1,Two men carry long objects on the sand .,275
3209620285_edfc479392.jpg,4,Two people stand out on the beach and hold long sticks that have flames on each end .,275
3209620285_edfc479392.jpg,3,Two people juggle fire sticks in the mud .,275
3209620285_edfc479392.jpg,0,Two men at the beach twirl sticks with fire at the ends .,275
3209620285_edfc479392.jpg,2,Two people are twirling fire sticks whilst standing on the sand .,275
2260560631_09093be4c6.jpg,4,The furry dog is running through a grassy wooded area .,276
2260560631_09093be4c6.jpg,0,A dirty dogs runs through the woods .,276
2260560631_09093be4c6.jpg,2,A dog jumping over a stick in the yard .,276
2260560631_09093be4c6.jpg,1,A dog carries a stick through the woods .,276
2260560631_09093be4c6.jpg,3,A dog jumps over a stick in a forest .,276
2527303359_6c3dc3f282.jpg,4,A woman in a white dress walks toward the water on a beach with white boots in the foreground .,277
2527303359_6c3dc3f282.jpg,0,A girl in a white dress on the beach .,277
2527303359_6c3dc3f282.jpg,3,A little girl in white leaves her boots behind as she walks in the sand .,277
2527303359_6c3dc3f282.jpg,1,A girl in a white dress walks toward the water and away from white boots on a beach .,277
2527303359_6c3dc3f282.jpg,2,A girl walking on a beach barefoot .,277
3171066023_ec60ba30f3.jpg,2,A person skis down a forested hill .,278
3171066023_ec60ba30f3.jpg,0,A downhill skier races near trees .,278
3171066023_ec60ba30f3.jpg,1,A person skis down a snowy and tree-filled hill .,278
3171066023_ec60ba30f3.jpg,3,A person skis through a forest of tall trees .,278
3171066023_ec60ba30f3.jpg,4,A skier is riding skis along a tree lined trail .,278
396763804_3b7f1e12a8.jpg,1,A brown dog with white paws running on the beach .,279
396763804_3b7f1e12a8.jpg,3,Two dogs are playing on the beach together .,279
396763804_3b7f1e12a8.jpg,4,Two dogs run along a beach .,279
396763804_3b7f1e12a8.jpg,2,There are two dogs running on the beach outside .,279
396763804_3b7f1e12a8.jpg,0,A black and white dog is running through the sand on a beach .,279
3301854980_233cc2f896.jpg,2,A snowboarder rides a snowboard down a railing beside a flight of steps .,280
3301854980_233cc2f896.jpg,0,A guy on a skateboard griding down a handrail .,280
3301854980_233cc2f896.jpg,4,boy skateboarding down a stair railing in winter,280
3301854980_233cc2f896.jpg,3,A snowboarder riding down a railing .,280
3301854980_233cc2f896.jpg,1,A kid skateboards down a set of railings on a snowy day .,280
2939464283_fc1a834976.jpg,1,a football player in a brown jersey jumping up to catch a football,281
2939464283_fc1a834976.jpg,3,Football players playing football .,281
2939464283_fc1a834976.jpg,2,A football player jumps up to catch the ball while others run towards him .,281
2939464283_fc1a834976.jpg,4,The football player jumps into the air to catch a football .,281
2939464283_fc1a834976.jpg,0,a football player catching the football .,281
759015118_4bd3617e60.jpg,2,A little boy walks around with a white t-shirt and black shorts outside .,282
759015118_4bd3617e60.jpg,3,A small boy looking at the camera .,282
759015118_4bd3617e60.jpg,4,The small boy is walking on a street lined with people .,282
759015118_4bd3617e60.jpg,0,A boy in a blue shirt .,282
759015118_4bd3617e60.jpg,1,"A little boy in a blue shirt looking at the camera , concrete in the background .",282
2404692474_37da774368.jpg,2,the dog barks at the toy .,283
2404692474_37da774368.jpg,1,A dog runs across the grass to get his toy .,283
2404692474_37da774368.jpg,3,The light colored dog is chasing after a toy outdoors .,283
2404692474_37da774368.jpg,0,A dog chasing a toy duck .,283
2404692474_37da774368.jpg,4,White dog chasing a yellow toy .,283
519754987_51861fea85.jpg,0,A skinny girl rides by on a bike with a lot of people in the background .,284
519754987_51861fea85.jpg,3,A young woman riding a bike down a street past a crowd of people .,284
519754987_51861fea85.jpg,1,A thin young woman in a green t-shirt cycles by a grey car .,284
519754987_51861fea85.jpg,4,People of all ilks on a busy street .,284
519754987_51861fea85.jpg,2,A woman riding a bicycle past a car and a group of people on a sidewalk .,284
3189251454_03b76c2e92.jpg,2,A tan dog with a black collar barking in the snow .,285
3189251454_03b76c2e92.jpg,0,A brown dog barks surrounded by white snow .,285
3189251454_03b76c2e92.jpg,3,dog barking,285
3189251454_03b76c2e92.jpg,4,Dog standing in snow barking .,285
3189251454_03b76c2e92.jpg,1,a dog wearing a black collar is standing open mouthed in the snow .,285
3544483327_830349e7bc.jpg,1,A man is jumping on a green bicycle over a sign that says ' free dinner ' .,286
3544483327_830349e7bc.jpg,0,"A man in all black is using a green bike to trick over a sign saying , "" Free Dinner "" .",286
3544483327_830349e7bc.jpg,4,boy on bike jumping over a sign,286
3544483327_830349e7bc.jpg,2,A man jumping a sign on his bike .,286
3544483327_830349e7bc.jpg,3,"A man on a bicycle is jumping over a sign that says "" free dinner "" .",286
3504158556_1d410c8ff7.jpg,1,Three men standing in front of a parked white care,287
3504158556_1d410c8ff7.jpg,3,Three young black men lean againest a white jeep .,287
3504158556_1d410c8ff7.jpg,4,Three young men lean on the front of a Toyota truck .,287
3504158556_1d410c8ff7.jpg,0,Some young boys hang out around their car .,287
3504158556_1d410c8ff7.jpg,2,Three teenage boys standing in front of a white car,287
3439128755_84409b8823.jpg,4,Two dogs fetching an object in a field .,288
3439128755_84409b8823.jpg,3,The two dogs with clothing are in a flat uncut field .,288
3439128755_84409b8823.jpg,2,A dog in a pink shirt with something white in his mouth and a dog in a yellow shirt .,288
3439128755_84409b8823.jpg,0,A brown dog in a pink shirt chews something white while a brown dog in yellow watches .,288
3439128755_84409b8823.jpg,1,A brown dog wearing a pink shirt is followed by a brown dog wearing a yellow shirt .,288
2367816288_7c2d11d3c5.jpg,1,A young man doing a flip on the grass .,289
2367816288_7c2d11d3c5.jpg,2,Boy doing cartwheels in backyard .,289
2367816288_7c2d11d3c5.jpg,4,Young boy in a brown shirt doing a back flip,289
2367816288_7c2d11d3c5.jpg,0,A boy cuts a flip in the grass .,289
2367816288_7c2d11d3c5.jpg,3,The boy does a flip over a grassy yard .,289
3476381830_3751dd9339.jpg,3,A person wearing a purple shirt stands on a skateboard at the top of a small stairway .,290
3476381830_3751dd9339.jpg,4,A skateboarder jumps off the stairs .,290
3476381830_3751dd9339.jpg,0,a boy wearing a red shirt on a skateboard jumps up some stairs,290
3476381830_3751dd9339.jpg,1,A dancer on steps .,290
3476381830_3751dd9339.jpg,2,A guy is skateboarding .,290
2655196158_5c878a4af0.jpg,3,A grey dog with blue eyes laying on a bright blue carpet while chewing on something .,291
2655196158_5c878a4af0.jpg,4,"The gray , blue eyed hound puppy is laying on a blue carpet chewing on a toy .",291
2655196158_5c878a4af0.jpg,2,A gray dog chewing on a toy .,291
2655196158_5c878a4af0.jpg,0,A dog chews on a toy on a blue blanket .,291
2655196158_5c878a4af0.jpg,1,"A dog is laying on a blue rug , chewing and making a mess .",291
2887798667_ce761d45e8.jpg,4,A youth on a bicycle wearing a white sweater riding along a wall .,292
2887798667_ce761d45e8.jpg,2,A person in grey is riding a bike on a brick wall .,292
2887798667_ce761d45e8.jpg,3,a young person riding a bike on the side of a brick wall,292
2887798667_ce761d45e8.jpg,1,A person in a hooded sweatshirt is doing a bicycle trick off of a wall .,292
2887798667_ce761d45e8.jpg,0,A guy doing a wallride on his bike,292
3415165462_e1cb536d08.jpg,2,A dog barks at plants in a walled concrete courtyard .,293
3415165462_e1cb536d08.jpg,3,A dog catches a ball in midair .,293
