image,caption_number,caption,id
341665272_80d4d61376.jpg,0,A brown dog carrying a Frisbee runs through the snow .,352
341665272_80d4d61376.jpg,1,A brown dog is running through the snow with a Frisbee in its mouth .,352
341665272_80d4d61376.jpg,2,A dog catches a red Frisbee in the snow .,352
341665272_80d4d61376.jpg,4,A dog is running in the snow carrying a red Frisbee .,352
3377117696_af91f13058.jpg,1,A person doing tricks on a slope .,353
3377117696_af91f13058.jpg,3,A skier goes upside down kicking snow in the air .,353
3377117696_af91f13058.jpg,2,A person is skiing and doing a flip in the snow .,353
3377117696_af91f13058.jpg,0,A man is in the air upside-down in the snow .,353
3377117696_af91f13058.jpg,4,A skier is doing a flip in the snow .,353
967719295_3257695095.jpg,1,A dog leaping into the water near a motorboat .,354
967719295_3257695095.jpg,2,A light colored dog jumping off the back of a boat into the water .,354
967719295_3257695095.jpg,3,A tan dog jumping off of a boat into the water .,354
967719295_3257695095.jpg,4,The yellow dog is jumping off of a ship into the water .,354
967719295_3257695095.jpg,0,a dog jumps into the pond .,354
3365348059_9773165302.jpg,0,A blonde woman is next to a man in a red shirt .,355
3365348059_9773165302.jpg,1,A blond woman is guessing a brown-haired man on the cheek .,355
3365348059_9773165302.jpg,3,A man muscular man wearing an orange shirt is being kissed on the cheek by a blond woman wearing a black shirt .,355
3365348059_9773165302.jpg,4,A woman kisses the cheek of a man in an orange t-shirt .,355
3365348059_9773165302.jpg,2,a blond woman kissing the cheek of a brown haired man .,355
195962790_3380aea352.jpg,2,A woman sits with her feet in a shallow pool and looks at a puppy .,356
195962790_3380aea352.jpg,4,Woman and dog cooling off at fountain,356
195962790_3380aea352.jpg,1,A woman sits by the pool with a dog while another dog is nearby .,356
195962790_3380aea352.jpg,3,"While the humans put their feet into the fountain , the puppy on the side with his master checks out the muzzle leash on the large rottweiler .",356
195962790_3380aea352.jpg,0,A woman in a purple shirt and a brown puppy sit near a fountain,356
1461667284_041c8a2475.jpg,4,Four people performing music outdoors .,357
1461667284_041c8a2475.jpg,0,A guitarist plays while people play with hula-hoops in the background .,357
1461667284_041c8a2475.jpg,1,"A guitarist sits playing before microphones , while a man and a boy dance and a woman stands by .",357
1461667284_041c8a2475.jpg,3,A man plays guitar on a stage while another woman smiles,357
1461667284_041c8a2475.jpg,2,A man in a white hat plays guitar on a stage .,357
2894576909_99c85fd7a7.jpg,0,A kayaker crashes against the force of the wave .,358
2894576909_99c85fd7a7.jpg,2,A man pilots a kayak through rough rapids .,358
2894576909_99c85fd7a7.jpg,4,This person in a red kayak faces a challange in the rapids .,358
2894576909_99c85fd7a7.jpg,1,a lone person in a red boat on a wild river with only one padel,358
2894576909_99c85fd7a7.jpg,3,A person riverrafting .,358
350176185_b8c5591e36.jpg,4,The German shepherd leaps off the stairs .,359
350176185_b8c5591e36.jpg,2,A German Shepherd jumps off of a set of stairs .,359
350176185_b8c5591e36.jpg,1,A dog jumps down a flight of stairs .,359
350176185_b8c5591e36.jpg,3,A woman watches a dog jump down the stairs .,359
350176185_b8c5591e36.jpg,0,A dog is jumping down the stairs .,359
2728486640_cc2a31d2b0.jpg,1,A white dog catching a milkbone in his mouth,360
2728486640_cc2a31d2b0.jpg,0,A dog catching a biscuit in its mouth .,360
2728486640_cc2a31d2b0.jpg,2,A white dog catching a treat in his mouth .,360
2728486640_cc2a31d2b0.jpg,4,"A white dog , with a black collar , opens its mouth wide while in front of a white building .",360
2728486640_cc2a31d2b0.jpg,3,A white dog is jumping for a treat,360
3619381206_5bc8b406f9.jpg,1,A man in a wetsuit and helmet walks in front of a bright red building .,361
3619381206_5bc8b406f9.jpg,4,A man is walking past a red building while wearing specialized gear .,361
3619381206_5bc8b406f9.jpg,0,A man in a wetsuit and helmet in front of a red wall .,361
3619381206_5bc8b406f9.jpg,3,A man is loaded up with gear to go diving into the ocean .,361
3619381206_5bc8b406f9.jpg,2,A man in scuba gear is walking .,361
3737711435_113ccd0a52.jpg,0,A girl in water-wear has skipped a stone off an enclosed body of water .,362
3737711435_113ccd0a52.jpg,3,a girl wearing a blue and pink swimsuit is throwing stones into a lake .,362
3737711435_113ccd0a52.jpg,2,A girl throws stones and watches the lake splash .,362
3737711435_113ccd0a52.jpg,1,A girl throws rocks into a lake .,362
3737711435_113ccd0a52.jpg,4,A woman skipping rocks on a lake,362
2064780645_8f28a1529f.jpg,0,A group of people standing in front of a setting sun .,363
2064780645_8f28a1529f.jpg,1,Children in a field at dusk .,363
2064780645_8f28a1529f.jpg,2,Several people are standing near trees at dusk .,363
2064780645_8f28a1529f.jpg,4,The sun is setting behind a group of people .,363
2064780645_8f28a1529f.jpg,3,The setting sun outlines a group of four people and the surrounding trees .,363
2478929971_9eb6c074b6.jpg,4,The six kids are in the shade of a leafy green tree .,364
2478929971_9eb6c074b6.jpg,3,Teenagers socializing in the shade .,364
2478929971_9eb6c074b6.jpg,2,A group of teenagers stand in a park .,364
2478929971_9eb6c074b6.jpg,1,A group of boys and girls sit and talk together under a tree,364
2478929971_9eb6c074b6.jpg,0,A girl dancing with four boys watching .,364
2337809114_899ba61330.jpg,4,Two young children are playing with a teenage girl who is blindfolded .,365
2337809114_899ba61330.jpg,0,A boy and girl are placing a red blindfold over a woman 's eyes .,365
2337809114_899ba61330.jpg,1,A girl is blindfolded by a young boy and girl .,365
2337809114_899ba61330.jpg,2,A person being blindfolded by a girl and a boy .,365
2337809114_899ba61330.jpg,3,"Three kids play , one is blindfolded .",365
2332986053_864db84971.jpg,4,A man with a blue helmet and orange shirt .,366
2332986053_864db84971.jpg,0,A man in an orange shirt and a blue hardhat smiles .,366
2332986053_864db84971.jpg,3,A man wearing an orange shirt and helmet .,366
2332986053_864db84971.jpg,2,A man wearing a helmet and sunglasses smiles .,366
2332986053_864db84971.jpg,1,A man smiling with a helmet on his head .,366
3184206563_5435f2b494.jpg,3,A woman runs outside in a blue coat .,367
3184206563_5435f2b494.jpg,0,A woman in a blue shirt runs through a field of dry grass .,367
3184206563_5435f2b494.jpg,2,a woman jogging on an open field,367
3184206563_5435f2b494.jpg,1,A woman in the blue sweater is running through a brown field .,367
3184206563_5435f2b494.jpg,4,The woman in the blue jacket ran through the field .,367
3006095077_1992b677f8.jpg,0,A couple of men in hats posing for a picture by a gas station .,368
3006095077_1992b677f8.jpg,2,Two men in hats pose together .,368
3006095077_1992b677f8.jpg,1,Two guys wearing jackets .,368
3006095077_1992b677f8.jpg,3,Two men wearing hats .,368
3006095077_1992b677f8.jpg,4,Two men wearing hats stand together and smile .,368
2182050469_1edac0bc60.jpg,3,a single person squated down at the edge of a pier overlooking a lake,369
2182050469_1edac0bc60.jpg,0,A person crouches at the end of a dock on a lake .,369
2182050469_1edac0bc60.jpg,1,A person is squatting at the end of a pier near a lake .,369
2182050469_1edac0bc60.jpg,2,A person with a red backpack squatting at the end of a dock .,369
2182050469_1edac0bc60.jpg,4,"I am squatting on a dock , looking into a lake .",369
2309327462_82a24538d4.jpg,2,Two dogs are playing in a fenced in area of gravel .,370
2309327462_82a24538d4.jpg,4,Two dogs walk over the gravel yard inside a gated area .,370
2309327462_82a24538d4.jpg,0,a dog chases another dog .,370
2309327462_82a24538d4.jpg,3,Two dogs run in a gravel lot with a fence in the foreground .,370
2309327462_82a24538d4.jpg,1,The white and brown dog is shaking its ears .,370
3040033126_9f4b88261b.jpg,2,A dog is taking a dive into a body of water .,371
3040033126_9f4b88261b.jpg,4,The dog is leaping into the water .,371
3040033126_9f4b88261b.jpg,1,A brown dog leaps into water from a rock .,371
3040033126_9f4b88261b.jpg,0,A brown dog jumping off a rock into a lake .,371
3040033126_9f4b88261b.jpg,3,A dog leaps over the water from a rock .,371
2480832276_fa55480ecb.jpg,1,A person climbing a boulder behind a tree .,372
2480832276_fa55480ecb.jpg,0,"A man in a red shirt climbs a rock in the background , a tree in the foreground .",372
2480832276_fa55480ecb.jpg,3,A person jumping in a rock and treefilled area .,372
2480832276_fa55480ecb.jpg,2,A person climbs a big rock under a tree .,372
2480832276_fa55480ecb.jpg,4,The boy in the red shirt climbs a large rock .,372
403523132_73b9a1a4b3.jpg,0,A dog is about to get a ball that is on orange carpet .,373
403523132_73b9a1a4b3.jpg,4,The dog crouched on the orange rug and stared at the tennis ball .,373
403523132_73b9a1a4b3.jpg,1,A dog on wood floor is staring at a yellow ball that is lying on orange carpet .,373
403523132_73b9a1a4b3.jpg,2,A little brown dog stares at a tennis ball on an orange carpet .,373
403523132_73b9a1a4b3.jpg,3,Puppy playing with a tennis ball on an orange rug .,373
509778093_21236bb64d.jpg,0,a brown and white dog chasing a ball on some grass .,374
509778093_21236bb64d.jpg,1,a brown and white dog has is playing with a white ball on the grass .,374
509778093_21236bb64d.jpg,3,A orange dog playing with a white ball on green grass .,374
509778093_21236bb64d.jpg,4,A small brown dog paws at a white ball,374
509778093_21236bb64d.jpg,2,A collie plays with a white ball in a field of green grass .,374
1580172290_e19067e0dd.jpg,2,Two children on hands and knees on a wood floor .,375
1580172290_e19067e0dd.jpg,1,A young boy crawls with a toddler .,375
1580172290_e19067e0dd.jpg,0,A baby and a young boy playing .,375
1580172290_e19067e0dd.jpg,4,two young babies crawling on a wood floor,375
1580172290_e19067e0dd.jpg,3,Two kids play on the floor .,375
299572828_4b38b80d16.jpg,2,A man in a plaid shirt uses a tool by a tree .,376
299572828_4b38b80d16.jpg,4,A man is scratching a rock with a red hammer .,376
299572828_4b38b80d16.jpg,3,A man in plaid shirt hits a tree with an Axe .,376
299572828_4b38b80d16.jpg,0,A closeup of a man that is rock climbing .,376
299572828_4b38b80d16.jpg,1,A man cuts down a tree with an ax .,376
3632842482_482f29e712.jpg,0,A brown dog in a Superman shirt is laying on a blue blanket .,377
3632842482_482f29e712.jpg,4,The brown dog with a superman shirt on sleeps on a blue blanket .,377
3632842482_482f29e712.jpg,2,"A dog in a "" superman "" shirt sleeps on a blanket .",377
3632842482_482f29e712.jpg,3,A dog wearing a t-shirt is lying down .,377
3632842482_482f29e712.jpg,1,A brown dog is laying down whilst wearing a superman shirt .,377
3737492755_bcfb800ed1.jpg,2,A man in costume drums in a parade .,378
3737492755_bcfb800ed1.jpg,1,"A man in black-yellow carnival feathers , playing the drum .",378
3737492755_bcfb800ed1.jpg,3,A man wearing an Indian costume is playing a snare drum .,378
3737492755_bcfb800ed1.jpg,4,There is a man in a black and yellow outfit playing the drums .,378
3737492755_bcfb800ed1.jpg,0,A man dressed in an Indian costume plays the drums .,378
3721881082_afe9fc734e.jpg,4,Two women sitting on a blanket on the lawn while sharing a book .,379
3721881082_afe9fc734e.jpg,3,"The girl and a lady are sitting on a blanket , reading a book .",379
3721881082_afe9fc734e.jpg,1,"A woman and girl wearing traditional clothes , sits on the front lawn , reading from a book .",379
3721881082_afe9fc734e.jpg,0,A woman and a girl sitting on a front lawn,379
3721881082_afe9fc734e.jpg,2,A woman wearing colonial clothing is sitting on the grass reading to a young girl .,379
3210705660_2b14b7fb36.jpg,3,Three school-aged children in uniforms jumping rope,380
3210705660_2b14b7fb36.jpg,1,Three children playing jump rope in the grass among the trees .,380
3210705660_2b14b7fb36.jpg,4,Two people are jumping rope outside .,380
3210705660_2b14b7fb36.jpg,2,Three people playing jump rope in a field .,380
3210705660_2b14b7fb36.jpg,0,A boy and girl are jumping rope together while another girl is holding the rope and turning .,380
1956678973_223cb1b847.jpg,4,Three kids jumping in leaves .,381
1956678973_223cb1b847.jpg,3,Small children are playing in a pile of dead leaves .,381
1956678973_223cb1b847.jpg,1,Four boys in red are playing with fallen leaves .,381
1956678973_223cb1b847.jpg,2,Several children leaping into a pile of leaves on the ground .,381
1956678973_223cb1b847.jpg,0,Children in red shirts play in the leaves .,381
1414820925_3504c394e1.jpg,2,A man in red swim trunks playing volleyball .,382
1414820925_3504c394e1.jpg,1,A man in red shorts jumps behind a volleyball net .,382
1414820925_3504c394e1.jpg,0,A man in red shorts jumping in back of a volleyball net .,382
1414820925_3504c394e1.jpg,3,Athletic man spiking volleyball .,382
1414820925_3504c394e1.jpg,4,Guy in red shorts jumping up in front of volleyball net,382
3375843443_8d9b242aa5.jpg,0,a lone skateboarder in midair with a huge wooden ramp and silver graffiti in the background,383
3375843443_8d9b242aa5.jpg,2,A skateboarder high in the air at indoor ramp .,383
3375843443_8d9b242aa5.jpg,4,Skateboarder performing a trick high in the air on a ramp .,383
3375843443_8d9b242aa5.jpg,1,A male skateboarder Takes advantage of the half pipe .,383
3375843443_8d9b242aa5.jpg,3,"Man on skateboard , jumping through the air .",383
3191982761_88793192ed.jpg,4,Four young people are standing in a run down alleyway posing for a picture .,384
3191982761_88793192ed.jpg,0,A group of five men are standing in the middle of a room that is crumbling and abandoned .,384
3191982761_88793192ed.jpg,1,A group of guys who appear to be a band stand inside the dark graffiti-covered and rock-strewn building .,384
3191982761_88793192ed.jpg,2,"Five men are standing in a dark room , where there is debris and graffiti on the ground and walls .",384
3191982761_88793192ed.jpg,3,Five men are standing in a dark room with graffiti on the walls .,384
3681172959_6674c118d2.jpg,2,A woman in a blue shirt with no bra .,385
3681172959_6674c118d2.jpg,3,A young woman with a green hat is walking in the busy street .,385
3681172959_6674c118d2.jpg,4,The young lady walks down the street on a beautiful day .,385
3681172959_6674c118d2.jpg,0,A girl in a blue shirt is grinning and walking in a crowd or people .,385
3681172959_6674c118d2.jpg,1,A girl wearing a tight blue shirt and an army cap walks in a crowd .,385
1130369873_d80a1aa59c.jpg,1,A brown dog splashes in the water while carrying a ball in its mouth .,386
1130369873_d80a1aa59c.jpg,2,A brown dog swims through water outdoors with a tennis ball in its mouth .,386
1130369873_d80a1aa59c.jpg,4,"Brown dog with tennis ball in mouth , in water and bushes .",386
1130369873_d80a1aa59c.jpg,0,A brown dog is running through neck-deep water carrying a tennis ball .,386
1130369873_d80a1aa59c.jpg,3,"A red dog , holding a ball , splashes through vegetation filled water .",386
808245064_8a7971fc5b.jpg,0,A dark skinned man smoking a cigarette near a green trashcan .,387
808245064_8a7971fc5b.jpg,2,a man in a blue shirt smoking a cigarette,387
808245064_8a7971fc5b.jpg,1,A man in a blue shirt is standing outside smoking a cigarette .,387
808245064_8a7971fc5b.jpg,3,A man stands outside smoking a cigarette,387
808245064_8a7971fc5b.jpg,4,A man with glasses smokes a cigarette .,387
186890601_8a6b0f1769.jpg,4,This man is swinging on the rope swing out over the blue water .,388
186890601_8a6b0f1769.jpg,1,A man in red shorts swinging on a rope over a lake .,388
186890601_8a6b0f1769.jpg,0,A man in a maroon bathing suit swings on a rope on a lake .,388
186890601_8a6b0f1769.jpg,3,A man is swinging on a rope over water .,388
186890601_8a6b0f1769.jpg,2,A man is swinging on a rope above the water .,388
514990193_2d2422af2c.jpg,0,A woman is laying on a striped couch on a grassy yard in a residential neighborhood .,389
514990193_2d2422af2c.jpg,2,A woman lies down on an old couch sitting on the grass .,389
514990193_2d2422af2c.jpg,1,A woman lays on a sofa in a yard .,389
514990193_2d2422af2c.jpg,3,Girl poses on couch on suburban lawn .,389
514990193_2d2422af2c.jpg,4,There is a couch sitting on grass with a girl in jeans and light brown hair on it .,389
3541483943_9776baee7c.jpg,4,"The boy is jumping a skateboard down the steps , surrounded by graffiti covered walls .",390
3541483943_9776baee7c.jpg,0,A man performing a trick on a skateboard at a graffiti covered skate park .,390
3541483943_9776baee7c.jpg,2,a skateboarder has kicked his board up onto its back wheels in an indoor skate center .,390
3541483943_9776baee7c.jpg,3,A skateboarder jumping down the stairs .,390
3541483943_9776baee7c.jpg,1,A man wearing a grey shirt is doing a skateboard trick on stairs .,390
370614351_98b8a166b9.jpg,0,A man with a Mohawk with his arms in the air .,391
370614351_98b8a166b9.jpg,2,A person in a kilt and a sports jersey and a Mohawk is in a store .,391
370614351_98b8a166b9.jpg,1,A man with multicolored hair wearing a weird outfit,391
370614351_98b8a166b9.jpg,4,The man with the eccentric clothing and hair poses in a store .,391
370614351_98b8a166b9.jpg,3,Punk rocker buys computer ink in the big-box store .,391
2451114871_8617ae2f16.jpg,0,Dogs run at a dog racetrack .,392
2451114871_8617ae2f16.jpg,4,Greyhounds racing chasing a mechanical rabbit around the track .,392
2451114871_8617ae2f16.jpg,3,Four dogs race around a turn .,392
2451114871_8617ae2f16.jpg,1,Dogs with muzzles are racing around a sandy track .,392
2451114871_8617ae2f16.jpg,2,"Four dogs in blue , green , red and black jerseys are racing .",392
2265100168_175f8218af.jpg,0,A laughing boy lies on a pit of blue balls .,393
2265100168_175f8218af.jpg,1,A pale boy playing in a pit of blue balls .,393
2265100168_175f8218af.jpg,4,Two children are playing in a bin of plastic balls .,393
2265100168_175f8218af.jpg,2,A young boy plays in a red ball pit .,393
2265100168_175f8218af.jpg,3,Blonde boy in red shirt plays inside inflatable with blue balls .,393
2903469015_a1e7d969c2.jpg,0,A greyhound wearing a yellow jacket runs a race .,394
2903469015_a1e7d969c2.jpg,1,A greyhound wearing number 8 is racing .,394
2903469015_a1e7d969c2.jpg,2,Muzzled greyhounds are racing along a dog track .,394
2903469015_a1e7d969c2.jpg,4,two muzzled greyhounds dogs racing around a track .,394
2903469015_a1e7d969c2.jpg,3,Two greyhounds with numbers run in a race on a track .,394
3090398639_68c0dfa9a5.jpg,1,A person wearing red rides a bicycle over a dirt path .,395
3090398639_68c0dfa9a5.jpg,0,a mountain biker is riding on a marked out competition trail in the woods .,395
3090398639_68c0dfa9a5.jpg,3,Bicyclist riding on a dirt race course .,395
3090398639_68c0dfa9a5.jpg,2,A woman rides a bike on a dirt path .,395
3090398639_68c0dfa9a5.jpg,4,Mountain bike riders on a dirt trail .,395
308307853_5a51fbdecc.jpg,2,A white dog walks across the sandy ground with a tumbleweed .,396
308307853_5a51fbdecc.jpg,4,poodle playing on a beach,396
308307853_5a51fbdecc.jpg,1,A white dog is running around a tumbleweed on a sand dune .,396
308307853_5a51fbdecc.jpg,3,A white poodle circles a sparkler embedded in sand .,396
308307853_5a51fbdecc.jpg,0,A dog plays on the beach .,396
241046599_28b0ca7b9f.jpg,1,a small brown dog is running across the grass wearing a purple and green coat .,397
241046599_28b0ca7b9f.jpg,3,"Brown dog , with green and purple cape , runs on grass .",397
241046599_28b0ca7b9f.jpg,2,A small dog wearing a purple and green cape,397
241046599_28b0ca7b9f.jpg,0,A miniature dachshund has an apron on its back .,397
241046599_28b0ca7b9f.jpg,4,The dog is wearing a purple cape .,397
3759230208_1c2a492b12.jpg,2,A young boy slides down a water slide with his eyes closed .,398
3759230208_1c2a492b12.jpg,1,a boy is being splashed in the face whilst riding a blue ring along a yellow water slide,398
3759230208_1c2a492b12.jpg,4,A young boy splashes down a water slide on a lawn .,398
3759230208_1c2a492b12.jpg,3,A young boy slides on a Slip 'n' Slide .,398
3759230208_1c2a492b12.jpg,0,A boy at the end of a slip and slide .,398
2892395757_0a1b0eedd2.jpg,3,Funky bicycle being raced,399
2892395757_0a1b0eedd2.jpg,0,A bicycler is riding a bike at a racing event .,399
2892395757_0a1b0eedd2.jpg,1,A cyclist wearing a black helmet is riding by some black vans .,399
2892395757_0a1b0eedd2.jpg,2,A person on a bicycle goes down the street .,399
2892395757_0a1b0eedd2.jpg,4,Man wearing helmet and racing gear on a bicycle,399
468930779_8008d90e10.jpg,4,closeup of a brown dog in the water holding a very large stick .,400
468930779_8008d90e10.jpg,3,A swimming dog with a small branch in its mouth .,400
468930779_8008d90e10.jpg,0,A brown dog carrying a stick in its mouth .,400
468930779_8008d90e10.jpg,2,A dog swimming with a stick in its mouth .,400
468930779_8008d90e10.jpg,1,A dog has its head coming up from the water as it holds a stick .,400
1453366750_6e8cf601bf.jpg,0,Two children are shown upside down .,401
1453366750_6e8cf601bf.jpg,4,Two women are laying upside down on a white bed .,401
1453366750_6e8cf601bf.jpg,3,Two teen girls hang playfully from the side of the bed,401
1453366750_6e8cf601bf.jpg,2,Two kids laying on a bed upside down,401
1453366750_6e8cf601bf.jpg,1,Two girls lay upside down on their bed .,401
225909073_25c3c33a29.jpg,1,A wet dog runs through the surf at a beach .,402
225909073_25c3c33a29.jpg,0,A black and brown dog is running out of the surf .,402
225909073_25c3c33a29.jpg,2,A wet German Shepherd dog is running out of the ocean with a ball in its mouth .,402
225909073_25c3c33a29.jpg,4,The German Shepherd is walking in the body of water .,402
225909073_25c3c33a29.jpg,3,German shepherd running in ocean surf,402
2848571082_26454cb981.jpg,3,Dog jumping to catch a soccer ball .,403
2848571082_26454cb981.jpg,0,A black and brown dog jumps in the air to catch a soccer ball .,403
2848571082_26454cb981.jpg,1,A black dog jumps to catch a ball in a yard .,403
2848571082_26454cb981.jpg,2,Black dog jumps for white ball .,403
2848571082_26454cb981.jpg,4,The black and brown dog jumps in the air to catch the ball .,403
1022454428_b6b660a67b.jpg,2,A couple with their newborn baby sitting under a tree facing a lake .,404
1022454428_b6b660a67b.jpg,4,Couple with a baby sit outdoors next to their stroller .,404
1022454428_b6b660a67b.jpg,0,"A couple and an infant , being held by the male , sitting next to a pond with a near by stroller .",404
1022454428_b6b660a67b.jpg,3,A man and woman care for an infant along the side of a body of water .,404
1022454428_b6b660a67b.jpg,1,A couple sit on the grass with a baby and stroller .,404
2872743471_30e0d1a90a.jpg,4,Four boys play on a merry-go-round at a park .,405
2872743471_30e0d1a90a.jpg,0,Four boys are playing at a playground,405
2872743471_30e0d1a90a.jpg,2,Four boys playing on a merry-go-round in a park .,405
2872743471_30e0d1a90a.jpg,1,Four boys are playing at a wooden playground .,405
2872743471_30e0d1a90a.jpg,3,Four boys playing on the inertia wheel at a park .,405
2527713011_b0ec25aa54.jpg,3,The black and white race car is rounding the turn .,406
2527713011_b0ec25aa54.jpg,4,The race car is speeding up the hill .,406
2527713011_b0ec25aa54.jpg,2,The black and white race car is going fast around the track while fans watch nearby .,406
2527713011_b0ec25aa54.jpg,0,A black and white rally car takes the turn .,406
2527713011_b0ec25aa54.jpg,1,A global group race car .,406
515702827_be3c6ce857.jpg,1,A girl in pink and man in black paddle through water .,407
515702827_be3c6ce857.jpg,0,A child in a pink hat on a pink surfboard .,407
515702827_be3c6ce857.jpg,2,A man in a black shirt swims next to a girl on a pink surfboard .,407
515702827_be3c6ce857.jpg,4,"Two children splash through the water , one is wearing a pink swim cap .",407
515702827_be3c6ce857.jpg,3,A man swimming beside a girl on a pink body board .,407
3590753142_61993d39df.jpg,4,Three people standing on boardwalk looking at buildings across the water .,408
3590753142_61993d39df.jpg,2,Three people are standing at a fence looking at a skyscraper filled city while one looks through a binocular scope .,408
3590753142_61993d39df.jpg,1,Sightseers look across the water at a city .,408
3590753142_61993d39df.jpg,0,A family is looking through binocular at a city over a body of water,408
3590753142_61993d39df.jpg,3,Three people lean against a railing and look at buildings across the water .,408
359173181_a75c950aeb.jpg,2,A dog runs through snow with a big tree in the distance .,409
359173181_a75c950aeb.jpg,0,A dog leaps through a snowy field .,409
359173181_a75c950aeb.jpg,1,"A dog runs through snow covered ground , near a tree .",409
359173181_a75c950aeb.jpg,3,Dog races through grass by lone tree .,409
359173181_a75c950aeb.jpg,4,"The brown , furry animal is walking in the snowy grass with a tree behind him .",409
302241178_a582c1b953.jpg,2,A large furry dog walking through the water with a big stick in his mouth .,410
302241178_a582c1b953.jpg,1,A dog picks up a stick with his mouth while treading through water .,410
302241178_a582c1b953.jpg,3,"The dog is holding a branch , swimming in the river .",410
302241178_a582c1b953.jpg,4,The dog retrieves the branch from the water .,410
302241178_a582c1b953.jpg,0,A dog in water carrying a long stick .,410
2584487952_f70e5aa9bf.jpg,2,a brown dog jumps into the grass .,411
2584487952_f70e5aa9bf.jpg,1,A brown dog jumps high on a field of grass .,411
2584487952_f70e5aa9bf.jpg,0,A brown dog jumps high in the grass .,411
2584487952_f70e5aa9bf.jpg,4,A red dog jumping up in a field of tall grass .,411
2584487952_f70e5aa9bf.jpg,3,A dog is jumping in the air in a field of grass .,411
2939371251_f923569a72.jpg,0,"A football player runs with the ball , chased by members of the opposing team",412
2939371251_f923569a72.jpg,1,A running back running with the football .,412
